<?xml version="1.0" encoding="utf-8"?>
<!DOCTYPE document SYSTEM "../../../xml/adaps.dtd">
<document>
    <title>Extract from Modifications to the Aesop's Fable Paradigm Change New Caledonian Crow Performances</title>
    <citation> Logan CJ, Jelbert SA, Breen AJ, Gray RD, Taylor AH (2014) Modifications to the Aesop's Fable Paradigm Change New Caledonian Crow Performances. PLoS ONE 9(7): e103049. doi:10.1371/journal.pone.0103049 
        Retrieved from http://journals.plos.org/plosone/article?id=10.1371/journal.pone.0103049 on 07 Dec 2016</citation>
    <url>http://journals.plos.org/plosone/article?id=10.1371/journal.pone.0103049</url>
    <body>
        <paragraph id="p01">
            <sentence id="p01-s01">
                <t id="p01-s01-t01">While</t>
                <t id="p01-s01-t02">previous</t>
                <t id="p01-s01-t03">work</t>
                <t id="p01-s01-t04">has</t>
                <t id="p01-s01-t05">suggested</t>
                <t id="p01-s01-t06">that</t>
                <t id="p01-s01-t07">New</t>
                <t id="p01-s01-t08">Caledonian</t>
                <t id="p01-s01-t09">crows</t>
                <punc>[</punc>
                <t id="p01-s01-t10">13</t>
                <punc>]</punc>
                <punc>,</punc>
                <t id="p01-s01-t11">like</t>
                <t id="p01-s01-t12">Eurasian</t>
                <t id="p01-s01-t13">jays</t>
                <punc>[</punc>
                <t id="p01-s01-t14">18</t>
                <punc>]</punc>
                <punc>,</punc>
                <t id="p01-s01-t15">and</t>
                <t id="p01-s01-t16">children</t>
                <t id="p01-s01-t17">under</t>
                <t id="p01-s01-t18">7</t>
                <t id="p01-s01-t19">years</t>
                <t id="p01-s01-t20">of</t>
                <t id="p01-s01-t21">age</t>
                <punc>[</punc>
                <t id="p01-s01-t22">16</t>
                <punc>]</punc>
                <punc>,</punc>
                <t id="p01-s01-t23">cannot</t>
                <t id="p01-s01-t24">solve</t>
                <t id="p01-s01-t25">the</t>
                <t id="p01-s01-t26">U</t>
				<punc>-</punc>
				<t id="p01-s01-t27">tube</t>
                <t id="p01-s01-t28">task</t>
                <punc>,</punc>
                <t id="p01-s01-t29">here</t>
                <t id="p01-s01-t30">one</t>
                <t id="p01-s01-t31">crow</t>
                <punc>,</punc>
                <t id="p01-s01-t32">Kitty</t>
                <punc>,</punc>
                <t id="p01-s01-t33">was</t>
                <t id="p01-s01-t34">able</t>
                <t id="p01-s01-t35">to</t>
                <t id="p01-s01-t36">do</t>
                <t id="p01-s01-t37">so</t>
                <t id="p01-s01-t38">by</t>
                <t id="p01-s01-t39">learning</t>
                <t id="p01-s01-t40">the</t>
                <t id="p01-s01-t41">connection</t>
                <t id="p01-s01-t42">between</t>
                <t id="p01-s01-t43">the</t>
                <t id="p01-s01-t44">arbitrary</t>
                <t id="p01-s01-t45">color</t>
                <t id="p01-s01-t46">cue</t>
                <t id="p01-s01-t47">and</t>
                <t id="p01-s01-t48">the</t>
                <t id="p01-s01-t49">movement</t>
                <t id="p01-s01-t50">of</t>
                <t id="p01-s01-t51">the</t>
                <t id="p01-s01-t52">food</t>
                <punc>.</punc>
            </sentence>
        </paragraph>
    </body>
</document>
