<?xml version="1.0" encoding="utf-8"?>
<!DOCTYPE document
  SYSTEM "../../../xml/adaps.dtd">
<document>
    <title>1st century BC (Extract)</title>
    <citation>Simple English Wikipedia: “1st century BC”. Retrieved from https://simple.wikipedia.org/wiki/1st_century_BC on 20 Aug 2015.</citation>
    <url>https://simple.wikipedia.org/wiki/1st_century_BC</url>
    <info type="arise">
        <arise-info book="2"
                    section="2"
                    unit="2"
                    part="4"
                    item="0"
                    firstpage="19"/>
    </info>
    <body>
        <paragraph id="p01">
            <sentence id="p01-s01">
                <t id="p01-s01-t01" type="GSL-1">The</t>
                <t id="p01-s01-t02">1st</t>
                    <t id="p01-s01-t03" type="GSL-2">century</t>
                <t id="p01-s01-t04">BC</t>
                <t id="p01-s01-t05" type="GSL-1">started</t>
                <t id="p01-s01-t06" type="GSL-1">on</t>
                <t id="p01-s01-t07" type="GSL-1">January</t>
                <t id="p01-s01-t08">1</t>
                <punc>,</punc>
                <t id="p01-s01-t09">100</t>
                <t id="p01-s01-t10">BC</t>
                <t id="p01-s01-t11" type="GSL-1">and</t>
                <t id="p01-s01-t12" type="GSL-1">ended</t>
                <t id="p01-s01-t13" type="GSL-1">on</t>
                <t id="p01-s01-t14" type="GSL-1">December</t>
                <t id="p01-s01-t15">31</t>
                <punc>,</punc>
                <t id="p01-s01-t16">1</t>
                <t id="p01-s01-t17">BC</t>
                <punc>.</punc>
            </sentence>
            <sentence id="p01-s02">
                <t id="p01-s02-t01" type="GSL-1">An</t>
                <t id="p01-s02-t02" type="Coxhead-AWL-3,AR-AWL-3a">alternative</t>
                <t id="p01-s02-t03" type="GSL-1">name</t>
                <t id="p01-s02-t04" type="GSL-1">for</t>
                <anaphor>
                    <t id="p01-s02-t05" type="GSL-1">this</t>
                    <t id="p01-s02-t06" type="GSL-2">century</t>
                </anaphor>
                <t id="p01-s02-t07" type="GSL-1">is</t>
                <t id="p01-s02-t08" type="GSL-1">the</t>
                <t id="p01-s02-t09" type="GSL-1">last</t>
                <t id="p01-s02-t10" type="GSL-2">century</t>
                <t id="p01-s02-t11">BC</t>
                <punc>.</punc>
            </sentence>
            <sentence id="p01-s03">
                <t id="p01-s03-t01" type="GSL-1">The</t>
                <t id="p01-s03-t02">AD/BC</t>
                <t id="p01-s03-t03">notation</t>
                <t id="p01-s03-t04" type="GSL-1">does</t>
                <t id="p01-s03-t05" type="GSL-1">not</t>
                <t id="p01-s03-t06" type="GSL-1">use</t>
                <t id="p01-s03-t07" type="GSL-1">a</t>
                <t id="p01-s03-t08" type="GSL-1">year</t>
                <t id="p01-s03-t09" type="GSL-2">zero</t>
                <punc>.</punc>
            </sentence>
            <sentence id="p01-s04">
                <t id="p01-s04-t01" type="GSL-1">Scientific</t>
                <t id="p01-s04-t02">notation</t>
                <t id="p01-s04-t03" type="GSL-1">does</t>
                <punc>,</punc>
                <connector>
                    <t id="p01-s04-t04" type="GSL-1">however</t>
                </connector>
                <t id="p01-s04-t05" type="GSL-1">use</t>
                <t id="p01-s04-t06" type="GSL-1">a</t>
                <t id="p01-s04-t07">minus</t>
                <t id="p01-s04-t08" type="GSL-1">sign</t>
                <punc>,</punc>
                <t id="p01-s04-t09" type="GSL-1">so</t>
                <punc>&#8216;</punc>
                <t id="p01-s04-t10">2</t>
                <t id="p01-s04-t11">BC</t>
                <punc>&#8217;</punc>
                <t id="p01-s04-t12" type="GSL-1">is</t>
                <t id="p01-s04-t13" type="GSL-1">equal</t>
                <t id="p01-s04-t14" type="GSL-1">to</t>
                <punc>&#8216;</punc>
                <t id="p01-s04-t15" type="GSL-1">year</t>
                <t id="p01-s04-t16">−1</t>
                <punc>&#8217;</punc>
                <punc>.</punc>
            </sentence>
        </paragraph>
    </body>
</document>
