<?xml version="1.0" encoding="utf-8"?>
<!DOCTYPE document
  SYSTEM "../../../xml/adaps.dtd">
<document>
    <title>Edubuntu (Extract)</title>
    <citation>Simple English Wikipedia: “Edubuntu”. Retrieved from https://simple.wikipedia.org/wiki/Edubuntu on 24 Aug 2015.</citation>
    <url>https://simple.wikipedia.org/wiki/Edubuntu</url>
    <info type="arise">
        <arise-info book="2"
                    section="2"
                    unit="1"
                    part="4"
                    item="5"
                    firstpage="16"/>
    </info>
    <body>
        <paragraph id="p01">
            <sentence id="p01-s01">
                <t id="p01-s01-t01" type="GSL-1">The</t>
                <t id="p01-s01-t02" type="Coxhead-AWL-4,AR-AWL-4b">principal</t>
                <t id="p01-s01-t03" type="Coxhead-AWL-2,AR-AWL-2a">design</t>
                <t id="p01-s01-t04" type="Coxhead-AWL-4,AR-AWL-4a">goals</t>
                <t id="p01-s01-t05" type="GSL-1">of</t>
                <t id="p01-s01-t06">Edubuntu</t>
                <t id="p01-s01-t07" type="GSL-1">are</t>
                <t id="p01-s01-t08" type="GSL-1">easier</t>
                <t id="p01-s01-t09">configuration</t>
                <punc>,</punc>
                <t id="p01-s01-t10" type="GSL-1">users</t>
                <t id="p01-s01-t11" type="GSL-1">and</t>
                <t id="p01-s01-t12" type="Coxhead-AWL-1,AR-AWL-1b">processes</t>
                <punc>,</punc>
                <t id="p01-s01-t13" type="GSL-1">together</t>
                <t id="p01-s01-t14" type="GSL-1">with</t>
                <t id="p01-s01-t15" type="GSL-1">ways</t>
                <t id="p01-s01-t16" type="GSL-1">for</t>
                <t id="p01-s01-t17" type="GSL-1">working</t>
                <t id="p01-s01-t18" type="GSL-1">together</t>
                <t id="p01-s01-t19" type="GSL-1">in</t>
                <t id="p01-s01-t20">classrooms</t>
                <punc>.</punc>
            </sentence>
            <sentence id="p01-s02">
                <connector>
                    <t id="p01-s02-t01" type="GSL-1">Equally</t>
                </connector>
                <t id="p01-s02-t02" type="GSL-1">important</t>
                <t id="p01-s02-t03" type="GSL-1">is</t>
                <t id="p01-s02-t04" type="GSL-1">the</t>
                <t id="p01-s02-t05" type="GSL-1">gathering</t>
                <t id="p01-s02-t06" type="GSL-1">together</t>
                <t id="p01-s02-t07" type="GSL-1">of</t>
                <t id="p01-s02-t08" type="GSL-1">the</t>
                <t id="p01-s02-t09" type="GSL-1">best</t>
                <t id="p01-s02-t10" type="Coxhead-AWL-1,AR-AWL-1a">available</t>
                <t id="p01-s02-t11" type="GSL-1">free</t>
                <t id="p01-s02-t12">software</t>
                <t id="p01-s02-t13" type="GSL-1">and</t>
                <t id="p01-s02-t14">digital</t>
                <t id="p01-s02-t15" type="GSL-1">materials</t>
                <t id="p01-s02-t16" type="GSL-1">for</t>
                <t id="p01-s02-t17" type="GSL-2">education</t>
                <punc>.</punc>
            </sentence>
        </paragraph>
    </body>
</document>
