<?xml version="1.0" encoding="utf-8"?>
<!DOCTYPE document
  SYSTEM "../../../xml/adaps.dtd">
<document>
    <title>Facebook Use Predicts Declines in Subjective Well-Being in Young Adults (Extract 1)</title>
    <citation>Kross E, Verduyn P, Demiralp E, Park J, Lee DS, et al., (2013), Facebook Use Predicts Declines in Subjective Well-Being in Young Adults., PLoS ONE 8(8): e69841., doi:10.1371/journal.pone.0069841</citation>
    <url>doi:10.1371/journal.pone.0069841</url>
    <info type="arise">
        <arise-info book="1"
                    section="2"
                    unit="6"
                    part="2"
                    item="E"
                    firstpage="28"/>
    </info>
    <body>
        <paragraph id="p01">
            <sentence id="p01-s01">
                <t id="p01-s01-t01">Within</t>
                <t id="p01-s01-t02">a</t>
                <t id="p01-s01-t03">relatively</t>
                <t id="p01-s01-t04">short</t>
                <t id="p01-s01-t05">timespan</t>
                <punc>,</punc>
                <t id="p01-s01-t06">Facebook</t>
                <t id="p01-s01-t07">has</t>
                <t id="p01-s01-t08">revolutionized</t>
                <t id="p01-s01-t09">the</t>
                <t id="p01-s01-t10">way</t>
                <t id="p01-s01-t11">people</t>
                <t id="p01-s01-t12">interact</t>
                <punc>.</punc>
            </sentence>
            <sentence id="p01-s02">
                <t id="p01-s02-t01">Yet</t>
                <punc>,</punc>
                <t id="p01-s02-t02">whether</t>
                <t id="p01-s02-t03">using</t>
                <t id="p01-s02-t04">Facebook</t>
                <t id="p01-s02-t05">predicts</t>
                <t id="p01-s02-t06">changes</t>
                <t id="p01-s02-t07">in</t>
                <t id="p01-s02-t08">subjective</t>
                <t id="p01-s02-t09">well-being</t>
                <t id="p01-s02-t10">over</t>
                <t id="p01-s02-t11">time</t>
                <t id="p01-s02-t12">is</t>
                <t id="p01-s02-t13">unknown</t>
                <punc>.</punc>
            </sentence>
            <sentence id="p01-s03">
                <t id="p01-s03-t01">We</t>
                <t id="p01-s03-t02">addressed</t>
                <t id="p01-s03-t03">this</t>
                <t id="p01-s03-t04">issue</t>
                <t id="p01-s03-t05">by</t>
                <t id="p01-s03-t06">performing</t>
                <t id="p01-s03-t07">lagged</t>
                <t id="p01-s03-t08">analyses</t>
                <t id="p01-s03-t09">on</t>
                <t id="p01-s03-t10">experience</t>
                <t id="p01-s03-t11">sampled</t>
                <t id="p01-s03-t12">data</t>
                <punc>,</punc>
                <t id="p01-s03-t13">an</t>
                <t id="p01-s03-t14">approach</t>
                <t id="p01-s03-t15">that</t>
                <t id="p01-s03-t16">allowed</t>
                <t id="p01-s03-t17">us</t>
                <t id="p01-s03-t18">to</t>
                <t id="p01-s03-t19">take</t>
                <t id="p01-s03-t20">advantage</t>
                <t id="p01-s03-t21">of</t>
                <t id="p01-s03-t22">the</t>
                <t id="p01-s03-t23">relative</t>
                <t id="p01-s03-t24">timing</t>
                <t id="p01-s03-t25">of</t>
                <t id="p01-s03-t26">participants'</t>
                <t id="p01-s03-t27">naturally</t>
                <t id="p01-s03-t28">occurring</t>
                <t id="p01-s03-t29">behaviors</t>
                <t id="p01-s03-t30">and</t>
                <t id="p01-s03-t31">psychological</t>
                <t id="p01-s03-t32">states</t>
                <t id="p01-s03-t33">to</t>
                <t id="p01-s03-t34">draw</t>
                <t id="p01-s03-t35">inferences</t>
                <t id="p01-s03-t36">about</t>
                <t id="p01-s03-t37">their</t>
                <t id="p01-s03-t38">likely</t>
                <t id="p01-s03-t39">causal</t>
                <t id="p01-s03-t40">sequence</t>
                <punc>[</punc>
                <t id="p01-s03-t41">17</t>
                <punc>]</punc>
                <punc>,</punc>
                <punc>[</punc>
                <t id="p01-s03-t42">18</t>
                <punc>]</punc>
                <punc>.</punc>
            </sentence>
            <sentence id="p01-s04">
                <t id="p01-s04-t01">These</t>
                <t id="p01-s04-t02">analyses</t>
                <t id="p01-s04-t03">indicated</t>
                <t id="p01-s04-t04">that</t>
                <t id="p01-s04-t05">Facebook</t>
                <t id="p01-s04-t06">use</t>
                <t id="p01-s04-t07">predicts</t>
                <t id="p01-s04-t08">declines</t>
                <t id="p01-s04-t09">in</t>
                <t id="p01-s04-t10">the</t>
                <t id="p01-s04-t11">two</t>
                <t id="p01-s04-t12">components</t>
                <t id="p01-s04-t13">of</t>
                <t id="p01-s04-t14">subjective</t>
                <t id="p01-s04-t15">well-being</t>
                <punc>:</punc>
                <t id="p01-s04-t16">how</t>
                <t id="p01-s04-t17">people</t>
                <t id="p01-s04-t18">feel</t>
                <t id="p01-s04-t19">moment</t>
                <t id="p01-s04-t20">to</t>
                <t id="p01-s04-t21">moment</t>
                <t id="p01-s04-t22">and</t>
                <t id="p01-s04-t23">how</t>
                <t id="p01-s04-t24">satisfied</t>
                <t id="p01-s04-t25">they</t>
                <t id="p01-s04-t26">are</t>
                <t id="p01-s04-t27">with</t>
                <t id="p01-s04-t28">their</t>
                <t id="p01-s04-t29">lives</t>
                <punc>.</punc>
            </sentence>
        </paragraph>
    </body>
</document>
