<?xml version="1.0" encoding="utf-8"?>
<!DOCTYPE document SYSTEM "../../../xml/adaps.dtd">
<document>
<title>Extract from If at First You Don’t Succeed, Sit Back and Listen</title>
<citation>Wallace, S (2014) If at First You Don’t Succeed, Sit Back and Listen. EveryONE (PLoS One blog).
Retrieved from http:// blogs.plos.org/everyone/2014/07/22/first-dont-succeed-sit-back-listen/ on 20 August 2015.</citation>
<url>http:// blogs.plos.org/everyone/2014/07/22/first-dont-succeed-sit-back-listen/</url>
<body>
<paragraph>
<sentence>
<t>Few</t>
<t>of</t>
<t>us</t>
<t>remember</t>
<t>how</t>
<t>easily</t>
<t>we</t>
<t>learned</t>
<t>language</t>
<t>as</t>
<t>children</t>
<punc>.</punc>
</sentence>
<sentence>
<t>Although</t>
<t>the</t>
<t>acquisition</t>
<t>wasn’t</t>
<t>always</t>
<t>graceful</t>
<t>then—‘awry’</t>
<t>never</t>
<t>sounds</t>
<t>the</t>
<t>same</t>
<t>way</t>
<t>aloud</t>
<t>as</t>
<t>the</t>
<t>way</t>
<t>I</t>
<t>read</t>
<t>it</t>
<t>in</t>
<t>my</t>
<t>head—</t>
<t>using</t>
<t>our</t>
<t>primary</t>
<t>language</t>
<t>as</t>
<t>an</t>
<t>adult</t>
<t>is</t>
<t>as</t>
<t>habitual</t>
<t>as</t>
<t>tying</t>
<t>shoelaces</t>
<t>and</t>
<t>seemingly</t>
<t>as</t>
<t>instinctual</t>
<t>as</t>
<t>smiling</t>
<punc>.</punc>
</sentence>
<sentence>
<t>Given</t>
<t>how</t>
<t>involuntarily</t>
<t>we</t>
<t>adults</t>
<t>use</t>
<t>our</t>
<t>primary</t>
<t>language</t>
<punc>,</punc>
<t>it’s</t>
<t>shocking</t>
<t>how</t>
<t>difficult</t>
<t>learning</t>
<t>new</t>
<t>languages</t>
<t>as</t>
<t>an</t>
<t>adult</t>
<t>can</t>
<t>be</t>
<punc>.</punc>
</sentence>
<sentence>
<t>The</t>
<t>authors</t>
<t>of</t>
<t>a</t>
<t>recent</t>
<t>PLOS</t>
<t>ONE</t>
<t>paper</t>
<t>postulated</t>
<t>that</t>
<t>the</t>
<t>very</t>
<t>functions</t>
<t>we</t>
<t>develop</t>
<t>as</t>
<t>our</t>
<t>brains</t>
<t>mature</t>
<t>as</t>
<t>adults</t>
<t>may</t>
<t>be</t>
<t>what</t>
<t>hinder</t>
<t>us</t>
<t>from</t>
<t>mastering</t>
<t>language</t>
<t>the</t>
<t>way</t>
<t>a</t>
<t>child</t>
<t>does</t>
<punc>.</punc>
</sentence>
<sentence>
<t>We</t>
<t>might</t>
<punc>,</punc>
<t>in</t>
<t>fact</t>
<punc>,</punc>
<t>be</t>
<punc>“</punc>
<t>trying</t>
<punc>”</punc>
<t>too</t>
<t>hard</t>
<punc>.</punc>
</sentence>
</paragraph>
<paragraph>
<sentence>
<t>Researchers</t>
<t>have</t>
<t>shown</t>
<t>in</t>
<t>previous</t>
<t>studies</t>
<t>that</t>
<t>adults</t>
<t>outperform</t>
<t>children</t>
<t>in</t>
<t>tasks</t>
<t>that</t>
<t>require</t>
<t>attentional</t>
<t>focus</t>
<t>and</t>
<t>effort</t>
<punc>.</punc>
</sentence>
<sentence>
<t>This</t>
<t>is</t>
<t>because</t>
<t>the</t>
<t>regions</t>
<t>of</t>
<t>the</t>
<t>brain</t>
<t>associated</t>
<t>with</t>
<t>these</t>
<t>abilities—the</t>
<t>prefrontal</t>
<t>and</t>
<t>parietal</t>
<t>cortices—develop</t>
<t>more</t>
<t>slowly</t>
<punc>,</punc>
<t>and</t>
<t>as</t>
<t>a</t>
<t>result</t>
<punc>,</punc>
<t>these</t>
<t>abilities</t>
<t>become</t>
<t>stronger</t>
<t>as</t>
<t>we</t>
<t>age</t>
<punc>.</punc>
</sentence>
<sentence>
<t>In</t>
<t>other</t>
<t>words</t>
<punc>,</punc>
<t>adult</t>
<t>brains</t>
<t>develop</t>
<t>abilities</t>
<t>that</t>
<t>help</t>
<t>us</t>
<punc>“</punc>
<t>try</t>
<t>harder</t>
<punc>.</punc>
<punc>”</punc>
</sentence>
<sentence>
<t>These</t>
<t>same</t>
<t>capabilities</t>
<t>may</t>
<punc>,</punc>
<t>however</t>
<punc>,</punc>
<t>interfere</t>
<t>with</t>
<t>our</t>
<t>capacity</t>
<t>to</t>
<t>learn</t>
<t>some</t>
<t>aspects</t>
<t>of</t>
<t>language</t>
<t>as</t>
<t>adults</t>
<punc>,</punc>
<t>like</t>
<t>the</t>
<t>tricky</t>
<t>networks</t>
<t>that</t>
<t>underlie</t>
<t>grammar</t>
<punc>.</punc>
</sentence>
</paragraph>
</body>
</document>
