<?xml version="1.0" encoding="utf-8"?>
<!DOCTYPE document
  SYSTEM "../../../xml/adaps.dtd">
<document>
    <title>Augmented reality (Extract)</title>
    <citation>Wikipedia contributors, "Augmented reality," Wikipedia, The Free Encyclopedia, https://en.wikipedia.org/w/index.php?title=Augmented_reality&amp;oldid=758501273 (accessed January 25, 2017).</citation>
    <url>https://en.wikipedia.org/w/index.php?title=Augmented_reality&amp;oldid=758501273</url>
    <info type="wikipedia"/>
    <body>
        <paragraph>
            <sentence>
                <t>Augmented</t>
                <t>reality</t>
                <punc>(</punc>
                <t>AR</t>
                <punc>)</punc>
                <t>is</t>
                <t>a</t>
                <t>live</t>
                <t>direct</t>
                <t>or</t>
                <t>indirect</t>
                <t>view</t>
                <t>of</t>
                <t>a</t>
                <t>physical</t>
                <punc>,</punc>
                <t>real</t>
                <punc>-</punc>
                <t>world</t>
                <t>environment</t>
                <t>whose</t>
                <t>elements</t>
                <t>are</t>
                <t>augmented</t>
                <punc>(</punc>
                <t>or</t>
                <t>supplemented</t>
                <punc>)</punc>
                <t>by</t>
                <t>computer</t>
                <punc>-</punc>
                <t>generated</t>
                <t>sensory</t>
                <t>input</t>
                <t>such</t>
                <t>as</t>
                <t>sound</t>
                <punc>,</punc>
                <t>video</t>
                <punc>,</punc>
                <t>graphics</t>
                <t>or</t>
                <t>GPS</t>
                <t>data</t>
                <punc>.</punc>
            </sentence>
            <sentence>
                <t>It</t>
                <t>is</t>
                <t>related</t>
                <t>to</t>
                <t>a</t>
                <t>more</t>
                <t>general</t>
                <t>concept</t>
                <t>called</t>
                <t>mediated</t>
                <t>reality</t>
                <punc>,</punc>
                <t>in</t>
                <t>which</t>
                <t>a</t>
                <t>view</t>
                <t>of</t>
                <t>reality</t>
                <t>is</t>
                <t>modified</t>
                <punc>(</punc>
                <t>possibly</t>
                <t>even</t>
                <t>diminished</t>
                <t>rather</t>
                <t>than</t>
                <t>augmented</t>
                <punc>)</punc>
                <t>by</t>
                <t>a</t>
                <t>computer</t>
                <punc>.</punc>
            </sentence>
            <sentence>
                <t>As</t>
                <t>a</t>
                <t>result</t>
                <punc>,</punc>
                <t>the</t>
                <t>technology</t>
                <t>functions</t>
                <t>by</t>
                <t>enhancing</t>
                <t>one's</t>
                <t>current</t>
                <t>perception</t>
                <t>of</t>
                <t>reality</t>
                <punc>.</punc>
                <t>[1]</t>
            </sentence>
            <sentence>
                <t>By</t>
                <t>contrast</t>
                <punc>,</punc>
                <t>virtual</t>
                <t>reality</t>
                <t>replaces</t>
                <t>the</t>
                <t>real</t>
                <t>world</t>
                <t>with</t>
                <t>a</t>
                <t>simulated</t>
                <t>one</t>
                <punc>.</punc>
                <t>[2][3]</t>
            </sentence>
            <sentence>
                <t>Augmentation</t>
                <t>is</t>
                <t>conventionally</t>
                <t>in</t>
                <t>real</t>
                <t>time</t>
                <t>and</t>
                <t>in</t>
                <t>semantic</t>
                <t>context</t>
                <t>with</t>
                <t>environmental</t>
                <t>elements</t>
                <punc>,</punc>
                <t>such</t>
                <t>as</t>
                <t>sports</t>
                <t>scores</t>
                <t>on</t>
                <t>TV</t>
                <t>during</t>
                <t>a</t>
                <t>match</t>
                <punc>.</punc>
            </sentence>
            <sentence>
                <t>With</t>
                <t>the</t>
                <t>help</t>
                <t>of</t>
                <t>advanced</t>
                <t>AR</t>
                <t>technology</t>
                <punc>(</punc>
                <t>e.g.</t>
                <t>adding</t>
                <t>computer</t>
                <t>vision</t>
                <t>and</t>
                <t>object</t>
                <t>recognition</t>
                <punc>)</punc>
                <t>the</t>
                <t>information</t>
                <t>about</t>
                <t>the</t>
                <t>surrounding</t>
                <t>real</t>
                <t>world</t>
                <t>of</t>
                <t>the</t>
                <t>user</t>
                <t>becomes</t>
                <t>interactive</t>
                <t>and</t>
                <t>digitally</t>
                <t>manipulable</t>
                <punc>.</punc>
            </sentence>
            <sentence>
                <t>Information</t>
                <t>about</t>
                <t>the</t>
                <t>environment</t>
                <t>and</t>
                <t>its</t>
                <t>objects</t>
                <t>is</t>
                <t>overlaid</t>
                <t>on</t>
                <t>the</t>
                <t>real</t>
                <t>world</t>
                <punc>.</punc>
            </sentence>
            <sentence>
                <t>This</t>
                <t>information</t>
                <t>can</t>
                <t>be</t>
                <t>virtual</t>
                <t>[4][5][6][7][8]</t>
                <t>or</t>
                <t>real</t>
                <punc>,</punc>
                <t>e.g.</t>
                <t>seeing</t>
                <t>other</t>
                <t>real</t>
                <t>sensed</t>
                <t>or</t>
                <t>measured</t>
                <t>information</t>
                <t>such</t>
                <t>as</t>
                <t>electromagnetic</t>
                <t>radio</t>
                <t>waves</t>
                <t>overlaid</t>
                <t>in</t>
                <t>exact</t>
                <t>alignment</t>
                <t>with</t>
                <t>where</t>
                <t>they</t>
                <t>actually</t>
                <t>are</t>
                <t>in</t>
                <t>space</t>
                <punc>.</punc>
                <t>[9][10]</t>
            </sentence>
            <sentence>
                <t>Augmented</t>
                <t>reality</t>
                <t>brings</t>
                <t>out</t>
                <t>the</t>
                <t>components</t>
                <t>of</t>
                <t>the</t>
                <t>digital</t>
                <t>world</t>
                <t>into</t>
                <t>a</t>
                <t>person's</t>
                <t>perceived</t>
                <t>real</t>
                <t>world</t>
                <punc>.</punc>
            </sentence>
            <sentence>
                <t>One</t>
                <t>example</t>
                <t>is</t>
                <t>an</t>
                <t>AR</t>
                <t>Helmet</t>
                <t>for</t>
                <t>construction</t>
                <t>workers</t>
                <t>which</t>
                <t>displays</t>
                <t>information</t>
                <t>about</t>
                <t>the</t>
                <t>construction</t>
                <t>sites</t>
                <punc>.</punc>
            </sentence>
        </paragraph>
    </body>
</document>
