<?xml version="1.0" encoding="utf-8"?>
<!DOCTYPE document SYSTEM "../../../xml/adaps.dtd">
<document>
    <title>Facebook Use Predicts Declines in Subjective Well-Being in Young Adults (Extract 1)</title>
    <citation>Kross E, Verduyn P, Demiralp E, Park J, Lee DS, et al., (2013), Facebook Use Predicts Declines in Subjective Well-Being in Young Adults., PLoS ONE 8(8): e69841., doi:10.1371/journal.pone.0069841</citation>
    <url>doi:10.1371/journal.pone.0069841</url>
    <info type="arise">
        <arise-info book="1" section="2" unit="6" part="2" item="E" firstpage="28"/>
    </info>
    <body>
        <paragraph>
            <sentence>
                <t>Within</t>
                <t>a</t>
                <t>relatively</t>
                <t>short</t>
                <t>timespan</t>
                <punc>,</punc>
                <t>Facebook</t>
                <t>has</t>
                <t>revolutionized</t>
                <t>the</t>
                <t>way</t>
                <t>people</t>
                <t>interact</t>
                <punc>.</punc>
            </sentence>
            <sentence>
                <t>Yet</t>
                <punc>,</punc>
                <t>whether</t>
                <t>using</t>
                <t>Facebook</t>
                <t>predicts</t>
                <t>changes</t>
                <t>in</t>
                <t>subjective</t>
                <t>well-being</t>
                <t>over</t>
                <t>time</t>
                <t>is</t>
                <t>unknown</t>
                <punc>.</punc>
            </sentence>
            <sentence>
                <t>We</t>
                <t>addressed</t>
                <t>this</t>
                <t>issue</t>
                <t>by</t>
                <t>performing</t>
                <t>lagged</t>
                <t>analyses</t>
                <t>on</t>
                <t>experience</t>
                <t>sampled</t>
                <t>data</t>
                <punc>,</punc>
                <t>an</t>
                <t>approach</t>
                <t>that</t>
                <t>allowed</t>
                <t>us</t>
                <t>to</t>
                <t>take</t>
                <t>advantage</t>
                <t>of</t>
                <t>the</t>
                <t>relative</t>
                <t>timing</t>
                <t>of</t>
                <t>participants'</t>
                <t>naturally</t>
                <t>occurring</t>
                <t>behaviors</t>
                <t>and</t>
                <t>psychological</t>
                <t>states</t>
                <t>to</t>
                <t>draw</t>
                <t>inferences</t>
                <t>about</t>
                <t>their</t>
                <t>likely</t>
                <t>causal</t>
                <t>sequence</t>
                <punc>[</punc>
                <t>17</t>
                <punc>]</punc>
                <punc>,</punc>
                <punc>[</punc>
                <t>18</t>
                <punc>]</punc>
                <punc>.</punc>
            </sentence>
            <sentence>
                <t>These</t>
                <t>analyses</t>
                <t>indicated</t>
                <t>that</t>
                <t>Facebook</t>
                <t>use</t>
                <t>predicts</t>
                <t>declines</t>
                <t>in</t>
                <t>the</t>
                <t>two</t>
                <t>components</t>
                <t>of</t>
                <t>subjective</t>
                <t>well-being</t>
                <punc>:</punc>
                <t>how</t>
                <t>people</t>
                <t>feel</t>
                <t>moment</t>
                <t>to</t>
                <t>moment</t>
                <t>and</t>
                <t>how</t>
                <t>satisfied</t>
                <t>they</t>
                <t>are</t>
                <t>with</t>
                <t>their</t>
                <t>lives</t>
                <punc>.</punc>
            </sentence>
        </paragraph>
    </body>
</document>
