<?xml version="1.0" encoding="utf-8"?>
<!DOCTYPE document
  SYSTEM "../../../xml/adaps.dtd">
<document>
    <title>Identifiable Images of Bystanders Extracted from Corneal Reflections (Extract)</title>
    <citation>Jenkins R, Kerr C (2013) Identifiable Images of Bystanders Extracted from Corneal Reflections. PLoS ONE 8(12): e83325. doi:10.1371/journal.pone.0083325</citation>
    <url>http://journals.plos.org/plosone/article?id=10.1371/journal.pone.0083325</url>
    <info type="arise">
        <arise-info book="1"
                    section="3"
                    unit="5"
                    part="1"
                    item="A"
                    firstpage="46"/>
    </info>
    <body>
        <paragraph id="p01">
            <sentence id="p01-s01">
                <t id="p01-s01-t01">By</t>
                <t id="p01-s01-t02">zooming</t>
                <t id="p01-s01-t03">in</t>
                <t id="p01-s01-t04">on</t>
                <t id="p01-s01-t05">high</t>
                <punc>-</punc>
                <t id="p01-s01-t06">resolution</t>
                <t id="p01-s01-t07">passport-style</t>
                <t id="p01-s01-t08">photographs</t>
                <punc>,</punc>
                <t id="p01-s01-t09">we</t>
                <t id="p01-s01-t10">were</t>
                <t id="p01-s01-t11">able</t>
                <t id="p01-s01-t12">to</t>
                <t id="p01-s01-t13">recover</t>
                <t id="p01-s01-t14">images</t>
                <t id="p01-s01-t15">of</t>
                <t id="p01-s01-t16">bystanders</t>
                <t id="p01-s01-t17">from</t>
                <t id="p01-s01-t18">reflections</t>
                <t id="p01-s01-t19">in</t>
                <t id="p01-s01-t20">the</t>
                <t id="p01-s01-t21">eyes</t>
                <t id="p01-s01-t22">of</t>
                <t id="p01-s01-t23">photographic</t>
                <t id="p01-s01-t24">subjects</t>
                <punc>.</punc>
            </sentence>
            <sentence id="p01-s02">
                <t id="p01-s02-t01">Performance</t>
                <t id="p01-s02-t02">in</t>
                <t id="p01-s02-t03">the</t>
                <t id="p01-s02-t04">face</t>
                <t id="p01-s02-t05">matching</t>
                <t id="p01-s02-t06">task</t>
                <punc>(</punc>
                <t id="p01-s02-t07">Experiment</t>
                <t id="p01-s02-t08">1</t>
                <punc>)</punc>
                <t id="p01-s02-t09">and</t>
                <t id="p01-s02-t10">the</t>
                <t id="p01-s02-t11">spontaneous</t>
                <t id="p01-s02-t12">recognition</t>
                <t id="p01-s02-t13">task</t>
                <punc>(</punc>
                <t id="p01-s02-t14">Experiment</t>
                <t id="p01-s02-t15">2</t>
                <punc>)</punc>
                <t id="p01-s02-t16">indicate</t>
                <t id="p01-s02-t17">that</t>
                <t id="p01-s02-t18">these</t>
                <t id="p01-s02-t19">bystander</t>
                <t id="p01-s02-t20">images</t>
                <t id="p01-s02-t21">were</t>
                <t id="p01-s02-t22">not</t>
                <t id="p01-s02-t23">merely</t>
                <t id="p01-s02-t24">informative</t>
                <t id="p01-s02-t25">about</t>
                <t id="p01-s02-t26">facial</t>
                <t id="p01-s02-t27">appearance</t>
                <punc>,</punc>
                <t id="p01-s02-t28">they</t>
                <t id="p01-s02-t29">were</t>
                <t id="p01-s02-t30">properly</t>
                <t id="p01-s02-t31">identifiable</t>
                <t id="p01-s02-t32">to</t>
                <t id="p01-s02-t33">viewers</t>
                <t id="p01-s02-t34">who</t>
                <t id="p01-s02-t35">knew</t>
                <t id="p01-s02-t36">the</t>
                <t id="p01-s02-t37">faces</t>
                <punc>.</punc>
            </sentence>
            <sentence id="p01-s03">
                <t id="p01-s03-t01">This</t>
                <t id="p01-s03-t02">is</t>
                <t id="p01-s03-t03">perhaps</t>
                <t id="p01-s03-t04">a</t>
                <t id="p01-s03-t05">surprising</t>
                <t id="p01-s03-t06">result</t>
                <punc>,</punc>
                <t id="p01-s03-t07">given</t>
                <t id="p01-s03-t08">the</t>
                <t id="p01-s03-t09">very</t>
                <t id="p01-s03-t10">unpromising</t>
                <t id="p01-s03-t11">source</t>
                <t id="p01-s03-t12">of</t>
                <t id="p01-s03-t13">these</t>
                <t id="p01-s03-t14">images</t>
                <punc>.</punc>
            </sentence>
            <sentence id="p01-s04">
                <t id="p01-s04-t01">However</t>
                <punc>,</punc>
                <t id="p01-s04-t02">it</t>
                <t id="p01-s04-t03">is</t>
                <t id="p01-s04-t04">consistent</t>
                <t id="p01-s04-t05">with</t>
                <t id="p01-s04-t06">previous</t>
                <t id="p01-s04-t07">evidence</t>
                <t id="p01-s04-t08">that</t>
                <t id="p01-s04-t09">familiar</t>
                <t id="p01-s04-t10">face</t>
                <t id="p01-s04-t11">recognition</t>
                <t id="p01-s04-t12">is</t>
                <t id="p01-s04-t13">extremely</t>
                <t id="p01-s04-t14">tolerant</t>
                <t id="p01-s04-t15">of</t>
                <t id="p01-s04-t16">poor</t>
                <t id="p01-s04-t17">image</t>
                <t id="p01-s04-t18">quality</t>
                <punc>[</punc>
                <t id="p01-s04-t19">16</t>
                <punc>]</punc>
                <punc>.</punc>
            </sentence>
        </paragraph>
    </body>
</document>
