<?xml version="1.0" encoding="utf-8"?>
<!DOCTYPE document
  SYSTEM "../../../xml/adaps.dtd">
<document>
    <title>Civil Engineering (Extract)</title>
    <citation>Simple English Wikipedia: “Civil Engineering”. Retrieved from http://simple.wikipedia.org/wiki/Civil_engineering on 19 Feb 2015.</citation>
    <url>http://simple.wikipedia.org/wiki/Civil_engineering</url>
    <info type="arise">
        <arise-info book="1"
                    section="3"
                    unit="5"
                    part="4"
                    item="3"
                    firstpage="48"/>
    </info>
    <body>
        <paragraph id="p01">
            <sentence id="p01-s01">
                <t id="p01-s01-t01">Civil</t>
                <t id="p01-s01-t02">engineering</t>
                <t id="p01-s01-t03">is</t>
                <t id="p01-s01-t04">made</t>
                <t id="p01-s01-t05">up</t>
                <t id="p01-s01-t06">of</t>
                <t id="p01-s01-t07">many</t>
                <t id="p01-s01-t08">different</t>
                <t id="p01-s01-t09">areas</t>
                <t id="p01-s01-t10">or</t>
                <t id="p01-s01-t11">disciplines</t>
                <punc>.</punc>
            </sentence>
            <sentence id="p01-s02">
                <t id="p01-s02-t01">Some</t>
                <t id="p01-s02-t02">important</t>
                <t id="p01-s02-t03">areas</t>
                <t id="p01-s02-t04">are</t>
                <t id="p01-s02-t05">geotechnical</t>
                <punc>,</punc>
                <t id="p01-s02-t06">structures</t>
                <punc>,</punc>
                <t id="p01-s02-t07">environmental</t>
                <punc>,</punc>
                <t id="p01-s02-t08">construction</t>
                <t id="p01-s02-t09">management</t>
                <punc>,</punc>
                <t id="p01-s02-t10">hydrology</t>
                <punc>,</punc>
                <t id="p01-s02-t11">transportation</t>
                <punc>,</punc>
                <t id="p01-s02-t12">and</t>
                <t id="p01-s02-t13">materials</t>
                <punc>.</punc>
            </sentence>
            <sentence id="p01-s03">
                <t id="p01-s03-t01">It</t>
                <t id="p01-s03-t02">is</t>
                <t id="p01-s03-t03">important</t>
                <t id="p01-s03-t04">for</t>
                <t id="p01-s03-t05">civil</t>
                <t id="p01-s03-t06">engineers</t>
                <t id="p01-s03-t07">to</t>
                <t id="p01-s03-t08">have</t>
                <t id="p01-s03-t09">an</t>
                <t id="p01-s03-t10">understanding</t>
                <t id="p01-s03-t11">of</t>
                <t id="p01-s03-t12">all</t>
                <t id="p01-s03-t13">these</t>
                <t id="p01-s03-t14">disciplines</t>
                <t id="p01-s03-t15">as</t>
                <t id="p01-s03-t16">projects</t>
                <t id="p01-s03-t17">often</t>
                <t id="p01-s03-t18">involve</t>
                <t id="p01-s03-t19">many</t>
                <t id="p01-s03-t20">of</t>
                <t id="p01-s03-t21">them</t>
                <t id="p01-s03-t22">at</t>
                <t id="p01-s03-t23">the</t>
                <t id="p01-s03-t24">same</t>
                <t id="p01-s03-t25">time</t>
                <punc>.</punc>
            </sentence>
        </paragraph>
    </body>
</document>
