<?xml version="1.0" encoding="utf-8"?>
<!DOCTYPE document SYSTEM "../../../xml/adaps.dtd">
<document>
    <title>Extract from The Science of Style: In Fashion, Colors Should Match Only Moderately</title>
    <citation>Gray K, Schmitt P, Strohminger N, Kassam KS (2014) The Science of Style: In Fashion, Colors Should Match Only Moderately. PLoS ONE 9(7): e102772. doi:10.1371/journal.pone.0102772
        Retrieved from http://journals.plos.org/plosone/article?id=10.1371/journal.pone.0102772 on 15 Dec 2016.</citation>
    <url>http://journals.plos.org/plosone/article?id=10.1371/journal.pone.0102772</url>
    <info type="arise">
        <arise-info book="2" section="2" unit="6" part="2" item="C" firstpage="29"/>
    </info>
    <body>
        <paragraph>
            <sentence>
                <t>In</t>
                <t>terms</t>
                <t>of</t>
                <t>fashion</t>
                <punc>,</punc>
                <t>there</t>
                <t>are</t>
                <t>two</t>
                <t>popular</t>
                <t>approaches</t>
                <t>to</t>
                <t>style</t>
                <t>that</t>
                <t>represent</t>
                <punc>“</punc>
                <t>extremes</t>
                <punc>.</punc>
                <punc>”</punc>
            </sentence>
            <sentence>
                <t>On</t>
                <t>one</t>
                <t>hand</t>
                <punc>,</punc>
                <t>we</t>
                <t>often</t>
                <t>speak</t>
                <t>as</t>
                <t>if</t>
                <t>the</t>
                <t>most</t>
                <t>fashionable</t>
                <t>outfits</t>
                <t>are</t>
                <t>those</t>
                <t>that</t>
                <t>fully</t>
                <t>coordinate</t>
                <t>or</t>
                <punc>“</punc>
                <t>match</t>
                <punc>”</punc>
                <punc>[</punc>
                <t>10</t>
                <punc>]</punc>
                <punc>.</punc>
            </sentence>
            <sentence>
                <t>This</t>
                <t>suggests</t>
                <t>that</t>
                <t>pairing</t>
                <t>the</t>
                <t>same</t>
                <t>or</t>
                <t>similar</t>
                <t>colors</t>
                <t>with</t>
                <t>each</t>
                <t>other</t>
                <t>may</t>
                <t>be</t>
                <t>the</t>
                <t>key</t>
                <t>to</t>
                <t>fashion</t>
                <punc>.</punc>
            </sentence>
            <sentence>
                <t>On</t>
                <t>the</t>
                <t>other</t>
                <t>hand</t>
                <punc>,</punc>
                <t>fashion</t>
                <t>is</t>
                <t>often</t>
                <t>about</t>
                <t>being</t>
                <t>noticed</t>
                <punc>,</punc>
                <t>and</t>
                <t>so</t>
                <t>we</t>
                <t>might</t>
                <t>want</t>
                <t>color</t>
                <t>combinations</t>
                <t>that</t>
                <t>maximally</t>
                <t>differ</t>
                <t>from</t>
                <t>each</t>
                <t>other</t>
                <t>and</t>
                <punc>“</punc>
                <t>pop</t>
                <punc>”</punc>
                <punc>[</punc>
                <t>11</t>
                <punc>]</punc>
                <punc>.</punc>
            </sentence>
            <sentence>
                <t>Between</t>
                <t>these</t>
                <t>two</t>
                <t>extremes</t>
                <punc>,</punc>
                <t>the</t>
                <t>Goldilocks</t>
                <t>Principle</t>
                <t>suggests</t>
                <t>that</t>
                <t>the</t>
                <t>best</t>
                <t>color</t>
                <t>combinations</t>
                <t>are</t>
                <t>those</t>
                <t>that</t>
                <t>are</t>
                <t>neither</t>
                <t>too</t>
                <t>similar</t>
                <punc>(</punc>
                <punc>“</punc>
                <t>matchy</t>
                <punc>-</punc>
                <t>matchy</t>
                <punc>”</punc>
                <punc>)</punc>
                <t>nor</t>
                <t>too</t>
                <t>different</t>
                <punc>(</punc>
                <punc>“</punc>
                <t>clashing</t>
                <punc>”</punc>
                <punc>)</punc>
                <punc>.</punc>
            </sentence>
        </paragraph>
    </body>
</document>
