<?xml version="1.0" encoding="utf-8"?>
<!DOCTYPE document
  SYSTEM "../../../xml/adaps.dtd">
<document>
    <title>The Power of Kawaii: Viewing Cute Images Promotes a Careful Behavior and Narrows Attentional Focus (Extract)</title>
    <citation>Nittono H, Fukushima M, Yano A, Moriya H (2012) The Power of Kawaii: Viewing Cute Images Promotes a Careful Behavior and Narrows Attentional Focus. PLoS ONE 7(9): e46362. doi:10.1371/journal.pone.0046362</citation>
    <url>http://journals.plos.org/plosone/article?id=10.1371/journal.pone.0046362</url>
    <info type="arise">
        <arise-info book="1"
                    section="3"
                    unit="5"
                    part="4"
                    item="1"
                    firstpage="47"/>
    </info>
    <body>
        <paragraph id="p01">
            <sentence id="p01-s01">
                <t id="p01-s01-t01" type="GSL-1">The</t>
                <t id="p01-s01-t02" type="Coxhead-AWL-2,AR-AWL-2b">participants</t>
                <t id="p01-s01-t03" type="GSL-1">were</t>
                <t id="p01-s01-t04" type="GSL-1">asked</t>
                <t id="p01-s01-t05" type="GSL-1">to</t>
                <t id="p01-s01-t06" type="GSL-2">perform</t>
                <t id="p01-s01-t07" type="GSL-1">a</t>
                <t id="p01-s01-t08" type="Coxhead-AWL-3,AR-AWL-3b">task</t>
                <t id="p01-s01-t09" type="Coxhead-AWL-1,AR-AWL-1b">requiring</t>
                <t id="p01-s01-t10" type="GSL-1">a</t>
                <t id="p01-s01-t11" type="GSL-1">high</t>
                <t id="p01-s01-t12" type="GSL-1">level</t>
                <t id="p01-s01-t13" type="GSL-1">of</t>
                <t id="p01-s01-t14" type="Coxhead-AWL-4,AR-AWL-4a">concentration</t>
                <t id="p01-s01-t15" type="GSL-1">twice</t>
                <punc>,</punc>
                <t id="p01-s01-t16" type="GSL-1">with</t>
                <t id="p01-s01-t17" type="GSL-1">a</t>
                <t id="p01-s01-t18" type="GSL-1">break</t>
                <t id="p01-s01-t19" type="GSL-1">of</t>
                <t id="p01-s01-t20" type="GSL-1">a</t>
                <t id="p01-s01-t21" type="GSL-1">few</t>
                <t id="p01-s01-t22" type="GSL-1">minutes</t>
                <t id="p01-s01-t23" type="GSL-1">between</t>
                <anaphor>
                    <t id="p01-s01-t24" type="GSL-1">the</t>
                    <t id="p01-s01-t25" type="Coxhead-AWL-3,AR-AWL-3b">tasks</t>
                </anaphor>
                <t id="p01-s01-t26" type="GSL-1">for</t>
                <t id="p01-s01-t27" type="Coxhead-AWL-5,AR-AWL-5b">mental</t>
                <t id="p01-s01-t28" type="Coxhead-AWL-6,AR-AWL-6b">recovery</t>
                <punc>.</punc>
            </sentence>
        </paragraph>
    </body>
</document>
